{
  "cache_policy": {
    "disease_page_update_policy": "Use cached copies for reproducibility on this machine and source URLs for durable public references.",
    "full_source_commit_policy": "Do not commit full source pages unless redistribution is explicitly permitted and recorded.",
    "local_cache_git_policy": "ignored-by-git",
    "local_cache_root": ".skillforge/source-cache/clinical-statistical-expert/gliosis/2026-05-07"
  },
  "created": "2026-05-07",
  "disease": "gliosis",
  "purpose": "Track source URLs, local cache status, and reuse notes for updating gliosis.md.",
  "schema_version": "1.0",
  "sources": [
    {
      "bytes": null,
      "cache_status": "url-only",
      "checksum_sha256": "",
      "claim_breadth_supported": "Broad for MS disease-modifying therapy context; use for demyelinating mimic and treatment-status implications, not for gliosis as a standalone finding.",
      "content_type": "",
      "date_accessed": "2026-05-07",
      "disease": "gliosis",
      "final_url": "",
      "id": "aan-ms-dmt-guideline-2018",
      "license": "",
      "local_cache_path": null,
      "notes": "Added to anchor demyelinating-disease treatment context when chronic lesions are compared with nonspecific gliosis.",
      "reuse_status": "",
      "source_type": "professional society guideline",
      "supported_sections": [
        "Treatment, Response, And Outcome Context",
        "Guideline-Based Management Context",
        "Common Treatment Pathways"
      ],
      "title": "AAN Practice Guideline Recommendations: Disease-modifying Therapies for Adults with Multiple Sclerosis",
      "url": "https://www.aan.com/Guidelines/home/GuidelineDetail/898",
      "warnings": []
    },
    {
      "bytes": null,
      "cache_status": "url-only",
      "checksum_sha256": "",
      "claim_breadth_supported": "broad for imaging appropriateness in demyelinating diseases",
      "content_type": "",
      "date_accessed": "2026-05-07",
      "disease": "gliosis",
      "final_url": "",
      "id": "acr-demyelinating-diseases-jacr-2026",
      "license": "",
      "local_cache_path": null,
      "notes": "2026 ACR criteria article; use as modality-selection context, not gliosis-specific evidence.",
      "reuse_status": "",
      "source_type": "professional society criteria",
      "supported_sections": [
        "Other Modalities And When They Matter",
        "Missing Information To Ask For",
        "Similar-Presentation Diseases And Mimic-Aware Comparison"
      ],
      "title": "ACR Appropriateness Criteria Demyelinating Diseases",
      "url": "https://www.sciencedirect.com/science/article/pii/S1546144026000633",
      "warnings": []
    },
    {
      "bytes": 931800,
      "cache_status": "cached-local-only",
      "checksum_sha256": "ddbf34804e06cafa89928ffb5b51b32cd2bd522877fd733ca29d386f8397a560",
      "claim_breadth_supported": "broad for modality selection in seizure and epilepsy scenarios",
      "content_type": "text/html; charset=utf-8",
      "date_accessed": "2026-05-07",
      "disease": "gliosis",
      "final_url": "https://acsearch.acr.org/docs/69479/Narrative/",
      "id": "acr-seizures-epilepsy",
      "license": "",
      "local_cache_path": ".skillforge/source-cache/clinical-statistical-expert/gliosis/2026-05-07/acr-seizures-epilepsy.html",
      "notes": "",
      "reuse_status": "",
      "source_type": "professional society criteria",
      "supported_sections": [
        "Other Modalities And When They Matter",
        "Missing Information To Ask For"
      ],
      "title": "ACR Appropriateness Criteria Seizures and Epilepsy",
      "url": "https://acsearch.acr.org/docs/69479/Narrative/",
      "warnings": []
    },
    {
      "bytes": null,
      "cache_status": "url-only",
      "checksum_sha256": "",
      "claim_breadth_supported": "Broad for secondary prevention and outcome context after ischemic stroke or TIA; use for vascular/postischemic gliosis context, not gliosis generally.",
      "content_type": "",
      "date_accessed": "2026-05-07",
      "disease": "gliosis",
      "final_url": "",
      "id": "aha-asa-secondary-stroke-prevention-2021",
      "license": "",
      "local_cache_path": null,
      "notes": "Added to anchor postischemic/vascular treatment and outcome context when gliosis is a chronic sequela of stroke.",
      "reuse_status": "",
      "source_type": "professional society guideline",
      "supported_sections": [
        "Treatment, Response, And Outcome Context",
        "Guideline-Based Management Context",
        "Expected Outcomes And Prognostic Factors"
      ],
      "title": "2021 AHA/ASA Guideline for the Prevention of Stroke in Patients With Stroke and Transient Ischemic Attack",
      "url": "https://www.ahajournals.org/doi/10.1161/STR.0000000000000375",
      "warnings": []
    },
    {
      "bytes": 347142,
      "cache_status": "cached-local-only",
      "checksum_sha256": "7503ecea51e566571430b19c2d084e1518ba7a5e4e05a5247cc56bcf92db659b",
      "claim_breadth_supported": "narrow for radiomics differentiation from low-grade glioma",
      "content_type": "text/html; charset=utf-8",
      "date_accessed": "2026-05-07",
      "disease": "gliosis",
      "final_url": "https://link.springer.com/article/10.1186/s12880-023-01086-3?error=cookies_not_supported&code=90800950-9c70-4b7d-b078-5ddcb4a44bc3",
      "id": "bmc-glial-hyperplasia-low-grade-glioma",
      "license": "",
      "local_cache_path": ".skillforge/source-cache/clinical-statistical-expert/gliosis/2026-05-07/bmc-glial-hyperplasia-low-grade-glioma.html",
      "notes": "",
      "reuse_status": "",
      "source_type": "narrow technical study",
      "supported_sections": [
        "Similar-Presentation Diseases And Mimic-Aware Comparison",
        "Statistical Implications"
      ],
      "title": "Multiparametric MRI radiomics for differentiating glial cell hyperplasia from low-grade glioma",
      "url": "https://link.springer.com/article/10.1186/s12880-023-01086-3",
      "warnings": []
    },
    {
      "bytes": 769060,
      "cache_status": "cached-local-only",
      "checksum_sha256": "93178d968cbe9cf21491fcab08d2667e5e121941254eaec733c8d81b0d319de5",
      "claim_breadth_supported": "broad for chronic infarct encephalomalacia and gliotic margins",
      "content_type": "text/html; charset=utf-8",
      "date_accessed": "2026-05-07",
      "disease": "gliosis",
      "final_url": "https://www.cambridge.org/core/books/abs/brain-imaging-with-mri-and-ct/chronic-infarct/438854394934D0BE8E350046140C81D6",
      "id": "cambridge-chronic-infarct",
      "license": "",
      "local_cache_path": ".skillforge/source-cache/clinical-statistical-expert/gliosis/2026-05-07/cambridge-chronic-infarct.html",
      "notes": "",
      "reuse_status": "",
      "source_type": "textbook chapter",
      "supported_sections": [
        "What To Look For",
        "Stable Or Chronic Residual Findings",
        "Report Language Patterns"
      ],
      "title": "Brain Imaging with MRI and CT: Chronic Infarct",
      "url": "https://www.cambridge.org/core/books/brain-imaging-with-mri-and-ct/chronic-infarct/438854394934D0BE8E350046140C81D6",
      "warnings": []
    },
    {
      "bytes": null,
      "cache_status": "url-only",
      "checksum_sha256": "",
      "claim_breadth_supported": "Broad for adult diffuse glioma diagnosis, treatment, and follow-up context; use only for glioma and treated-tumor contexts, not for gliosis as a standalone finding.",
      "content_type": "",
      "date_accessed": "2026-05-07",
      "disease": "gliosis",
      "final_url": "",
      "id": "eano-diffuse-glioma-guidelines",
      "license": "",
      "local_cache_path": null,
      "notes": "Added to support guideline-based tumor-treatment context when gliosis occurs in or near treated glioma regions.",
      "reuse_status": "",
      "source_type": "professional society guideline",
      "supported_sections": [
        "Treatment, Response, And Outcome Context",
        "Guideline-Based Management Context",
        "Common Treatment Pathways"
      ],
      "title": "EANO guidelines on the diagnosis and treatment of diffuse gliomas of adulthood",
      "url": "https://pmc.ncbi.nlm.nih.gov/articles/PMC7904519/",
      "warnings": []
    },
    {
      "bytes": 904749,
      "cache_status": "cached-local-only",
      "checksum_sha256": "050278A1A99C3131D15D19D23975D6FBE0660732A6BC56BFBF8ADB523439C564",
      "claim_breadth_supported": "narrow to glial activation and neurodegenerative imaging",
      "content_type": "",
      "date_accessed": "2026-05-07",
      "disease": "gliosis",
      "final_url": "",
      "id": "frontiers-gliosis-pet-mr-neurodegenerative",
      "license": "Frontiers open-access page; verify exact license before redistributing full page",
      "local_cache_path": ".skillforge/source-cache/clinical-statistical-expert/gliosis/2026-05-07/frontiers-gliosis-pet-mr-neurodegenerative.html",
      "notes": "Use for PET/MR and glial activation context, not routine structural MRI claims.",
      "reuse_status": "",
      "source_type": "review article",
      "supported_sections": [
        "Other Modalities And When They Matter",
        "Statistical Implications"
      ],
      "title": "Gliosis and Neurodegenerative Diseases: The Role of PET and MR Imaging",
      "url": "https://www.frontiersin.org/journals/cellular-neuroscience/articles/10.3389/fncel.2020.00075/full",
      "warnings": []
    },
    {
      "bytes": null,
      "cache_status": "url-only",
      "checksum_sha256": "",
      "claim_breadth_supported": "broad for MS MRI protocol, monitoring, and reporting context",
      "content_type": "",
      "date_accessed": "2026-05-07",
      "disease": "gliosis",
      "final_url": "",
      "id": "magnims-cmsc-naims-ms-mri-2021",
      "license": "",
      "local_cache_path": null,